{
  "header": {
    "schema_id": "document_source.rendered_view_catalog",
    "schema_version": "2.0.0",
    "contract_id": "rendered_contract_example001",
    "content_hash": "99845498d562271d9a12dd50d387d59cf024b27c704b731da9214aeb56db7d89",
    "producer": "vysi.document_source",
    "producer_version": "0.2.0",
    "created_at": "2026-06-19T20:00:00Z",
    "status": "ok",
    "revision": 1,
    "supersedes": null,
    "extensions": {}
  },
  "document_id": "document_example001",
  "views": [],
  "surfaces": []
}
